{"$schema":"https://json-schema.org/draft/2020-12/schema","title":"AcquisitionProfile","description":"`AcquisitionProfile`: the plan’s strict wire record.","type":"object","properties":{"adapter":{"description":"Declared `adapter`; no inferred default.","$ref":"#/$defs/PolicyReference"},"collection_id":{"description":"Declared `collection_id`; no inferred default.","type":"string","maxLength":128,"minLength":1,"pattern":"^[A-Za-z0-9][A-Za-z0-9_.-]*$"},"id":{"description":"Declared `id`; no inferred default.","type":"string","maxLength":128,"minLength":1,"pattern":"^[A-Za-z0-9][A-Za-z0-9_.-]*$"},"owner_ref":{"description":"Declared `owner_ref`; no inferred default.","$ref":"#/$defs/PolicyReference"},"qualification":{"description":"Declared `qualification`; no inferred default.","$ref":"#/$defs/PolicyReference"},"readiness":{"description":"Declared `readiness`; no inferred default.","anyOf":[{"$ref":"#/$defs/Readiness"},{"type":"null"}]},"required_capabilities":{"description":"Declared `required_capabilities`; no inferred default.","type":"array","items":{"type":"string"},"maxItems":10000},"schema":{"description":"Declared `schema`; no inferred default.","$ref":"#/$defs/AcquisitionSchema"},"scope_tags":{"description":"Declared `scope_tags`; no inferred default.","type":"array","items":{"type":"string"},"maxItems":10000},"transport":{"description":"Declared `transport`; no inferred default.","$ref":"#/$defs/Transport"},"version":{"description":"Declared `version`; no inferred default.","type":"integer","format":"uint64","minimum":1},"visibility":{"description":"Declared `visibility`; no inferred default.","$ref":"#/$defs/Visibility"}},"additionalProperties":false,"required":["schema","id","version","collection_id","visibility","scope_tags","owner_ref","transport","adapter","required_capabilities","readiness","qualification"],"$defs":{"AcquisitionSchema":{"description":"The executable `AcquisitionProfile` version.","oneOf":[{"description":"Version one only.","type":"string","const":"maestro-acquisition-profile/1"}]},"Attribute":{"description":"Attribute: the plan’s strict wire record.","type":"object","properties":{"name":{"description":"Declared `name`; no inferred default.","type":"string","maxLength":128,"minLength":1,"pattern":"^[A-Za-z0-9][A-Za-z0-9_.-]*$"},"value":{"description":"Declared `value`; no inferred default.","type":"string","maxLength":4096}},"additionalProperties":false,"required":["name","value"]},"DocumentState":{"description":"The closed set of `DocumentState` values.","oneOf":[{"description":"`dom_content_loaded`.","type":"string","const":"dom_content_loaded"},{"description":"`load`.","type":"string","const":"load"}]},"DomStep":{"description":"`DomStep`: the plan’s strict wire record.","type":"object","properties":{"attributes":{"description":"Declared `attributes`; no inferred default.","type":"array","items":{"$ref":"#/$defs/Attribute"},"maxItems":8},"tag":{"description":"Declared `tag`; no inferred default.","type":"string","maxLength":128,"minLength":1,"pattern":"^[A-Za-z0-9][A-Za-z0-9_.-]*$"}},"additionalProperties":false,"required":["tag","attributes"]},"PolicyReference":{"description":"A source-policy resource identity, not a path or an access grant.","type":"object","properties":{"digest":{"description":"Exact immutable SHA-256 resource digest.","type":"string","pattern":"^[0-9a-f]{64}$"},"id":{"description":"Logical resource identifier, validated by the source-policy resolver.","type":"string","maxLength":128,"minLength":1,"pattern":"^[A-Za-z0-9][A-Za-z0-9_.-]*$"}},"additionalProperties":false,"required":["id","digest"]},"Readiness":{"description":"Readiness: the plan’s strict wire record.","type":"object","properties":{"all_of":{"description":"Declared `all_of`; no inferred default.","type":"array","items":{"$ref":"#/$defs/ReadyCondition"},"maxItems":32,"minItems":1},"document_state":{"description":"Declared `document_state`; no inferred default.","$ref":"#/$defs/DocumentState"},"poll_interval_ms":{"description":"Declared `poll_interval_ms`; no inferred default.","type":"integer","format":"uint64","minimum":1},"stable_for_ms":{"description":"Declared `stable_for_ms`; no inferred default.","type":"integer","format":"uint64","minimum":1},"timeout_ms":{"description":"Declared `timeout_ms`; no inferred default.","type":"integer","format":"uint64","minimum":1}},"additionalProperties":false,"required":["document_state","all_of","timeout_ms","poll_interval_ms","stable_for_ms"]},"ReadyCondition":{"description":"Declarative `ReadyCondition`; unknown predicates refuse.","oneOf":[{"description":"`element_present`.","type":"object","properties":{"kind":{"type":"string","const":"element_present"},"selector":{"description":"Explicit `selector`.","type":"array","items":{"$ref":"#/$defs/DomStep"},"maxItems":32,"minItems":1}},"additionalProperties":false,"required":["kind","selector"]},{"description":"`element_text`.","type":"object","properties":{"contains":{"description":"Explicit `contains`.","type":"string"},"kind":{"type":"string","const":"element_text"},"selector":{"description":"Explicit `selector`.","type":"array","items":{"$ref":"#/$defs/DomStep"},"maxItems":32,"minItems":1}},"additionalProperties":false,"required":["kind","selector","contains"]},{"description":"`element_absent`.","type":"object","properties":{"kind":{"type":"string","const":"element_absent"},"selector":{"description":"Explicit `selector`.","type":"array","items":{"$ref":"#/$defs/DomStep"},"maxItems":32,"minItems":1}},"additionalProperties":false,"required":["kind","selector"]}]},"Transport":{"description":"The closed set of Transport values.","oneOf":[{"description":"`http`.","type":"string","const":"http"},{"description":"`browser_request`.","type":"string","const":"browser_request"},{"description":"`browser_render`.","type":"string","const":"browser_render"}]},"Visibility":{"description":"The closed set of Visibility values.","oneOf":[{"description":"`public`.","type":"string","const":"public"},{"description":"`private`.","type":"string","const":"private"}]}}}
